### ISSUE TITLE
Flutter tool cannot attach to any process

### ISSUE THREAD

**Issue by unixzii** [flutter/flutter#33364]
## Steps to Reproduce

1. Start a Flutter app via `flutter run -v` and grab the Observatory URL (eg. `http://127.0.0.1:54655/a2zuiehTqFQ=/`).
2. In another terminal session, run `flutter attach --debug-uri=http://127.0.0.1:54655/a2zuiehTqFQ\=/ -v`.

## Logs

The attach command printed out these logs:
```
[  +31 ms] executing: [/Users/cyandev/Developer/libraries/flutter/] git log -n 1 --pretty=format:%H
[  +45 ms] Exit code 0 from: git log -n 1 --pretty=format:%H
[        ] 7a4c33425ddd78c54aba07d86f3f9a4a0051769b
[        ] executing: [/Users/cyandev/Developer/libraries/flutter/] git describe --match v*.*.* --first-parent --long --tags
[  +14 ms] Exit code 0 from: git describe --match v*.*.* --first-parent --long --tags
[        ] v1.5.4-hotfix.2-0-g7a4c33425
[  +12 ms] executing: [/Users/cyandev/Developer/libraries/flutter/] git rev-parse --abbrev-ref --symbolic @{u}
[  +12 ms] Exit code 0 from: git rev-parse --abbrev-ref --symbolic @{u}
[        ] origin/stable
[        ] executing: [/Users/cyandev/Developer/libraries/flutter/] git ls-remote --get-url origin
[  +12 ms] Exit code 0 from: git ls-remote --get-url origin
[        ] https://github.com/flutter/flutter.git
[  +60 ms] executing: [/Users/cyandev/Developer/libraries/flutter/] git rev-parse --abbrev-ref HEAD
[  +13 ms] Exit code 0 from: git rev-parse --abbrev-ref HEAD
[        ] stable
[ +335 ms] executing: /Users/cyandev/Library/Android/sdk/platform-tools/adb devices -l
[  +11 ms] Exit code 0 from: /Users/cyandev/Library/Android/sdk/platform-tools/adb devices -l
[        ] List of devices attached
[   +6 ms] executing: idevice_id -h
[   +3 ms] /usr/bin/xcrun simctl list --json devices
[ +258 ms] Artifact Instance of 'FlutterWebSdk' is not required, skipping update.
[   +5 ms] Artifact Instance of 'WindowsEngineArtifacts' is not required, skipping update.
[        ] Artifact Instance of 'MacOSEngineArtifacts' is not required, skipping update.
[        ] Artifact Instance of 'LinuxEngineArtifacts' is not required, skipping update.
[        ] Artifact Instance of 'FuchsiaCacheArtifacts' is not required, skipping update.
[ +168 ms] Connecting to service protocol: http://127.0.0.1:54655/a2zuiehTqFQ=/
```
And then it had no response forever.

After some of my debugging, I found that the WebSocket behind the scene behaved strangely.

I set a breakpoint at the flutter_tools' `vmservice.dart:89`:
```dart
  while (socket == null) {
    attempts += 1;
    try {
>     socket = await constructor(uri.toString(), compression: compression);
    } on io.WebSocketException catch (e) {
      await handleError(e);
    } on io.SocketException catch (e) {
      await handleError(e);
    }
  }
```
And I let it go, the `socket` variable is set to a non-null instance and no error is thrown, but the connection is indeed closed. Here is my Wireshark log:
```
GET /a2zuiehTqFQ=/ws HTTP/1.1

54655 → 54682 [ACK] Seq=1 Ack=339 Win=407936 Len=0 TSval=1436864806
TSecr=1436864806

HTTP/1.1 101 Switching Protocols

54682 → 54655 [ACK] Seq=339 Ack=358 Win=407936 Len=0 TSval=1436864807
TSecr=1436864807

54682 → 54655 [FIN, ACK] Seq=339 Ack=358 Win=407936 Len=0 TSval=1436864807
TSecr=1436864807

54655 → 54682 [ACK] Seq=358 Ack=340 Win=407936 Len=0 TSval=1436864807
TSecr=1436864807

WebSocket Connection Close [FIN]

54682 → 54655 [RST] Seq=340 Win=0 Len=0
```
The socket at the flutter_tools side closed abnormally.

To validate that, I write a little program:
```dart
import 'dart:io';

Future main() async {
  final WebSocket ws = await WebSocket.connect("ws://127.0.0.1:53318/4vpF_Md6LRo=/ws", compression: CompressionOptions.compressionDefault);
  ws.add("Hello");
}
```
Unfortunately, this program also didn't work. I think the WebSocket implementation in Dart SDK is buggy.

**Comment by unixzii** [comment]
There is a similar issue that maybe help:
[https://github.com/dart-lang/sdk/issues/34838](https://github.com/dart-lang/sdk/issues/34838)

**Comment by iapicca** [comment]
Hi @unixzii 
I see there's an open issue addressing the case you described.
(thank you @unixzii )
Please follow up on that issue,
I'm closing the current one as duplicate.
If you disagree please write in the comments
and I will reopen it.
Thank you
